{
  "date": "2026-09-18",
  "title": "Bianchi di Spagna in Toasted Almond Majado with Palmkool, Orange, and Sumac alongside Coriander-Roasted Carrots",
  "type": "savory",
  "course": [
    "main",
    "side"
  ],
  "corpus_role": [
    "technique-study",
    "experiment"
  ],
  "servings": 2,
  "rating": 5.0,
  "rating_scale": "1-5",
  "tags": [
    "bianchi-di-spagna",
    "butter-beans",
    "palmkool",
    "cavolo-nero",
    "almond-majado",
    "emulsion",
    "shiitake-broth",
    "pasta-water",
    "roasted-carrots",
    "coriander-seed",
    "sumac",
    "vegan"
  ]
}