{
  "date": "2026-09-08",
  "title": "Braised Giant White Beans with Rainbow Chard, Coriander Seeds & Sumac",
  "type": "savory",
  "course": ["main", "small-plate"],
  "corpus_role": ["weeknight-staple", "technique-study"],
  "servings": 2,
  "rating": 4.0,
  "rating_scale": "1-5",
  "tags": [
    "white-beans",
    "rainbow-chard",
    "coriander-seeds",
    "sumac",
    "stovetop",
    "braise",
    "legume-focus"
  ]
}