{
  "date": "2026-09-16",
  "title": "Braised Leek Confit with Shiitake, Fig & Leek Sofrito",
  "type": "savory",
  "course": ["small-plate"],
  "corpus_role": ["technique-study"],
  "servings": 2,
  "rating": 5.0,
  "rating_scale": "1-5",
  "tags": [
    "leek",
    "shiitake",
    "figs",
    "fennel-seed",
    "stovetop",
    "allium-focus"
  ]
}